Id,Title,Company,Location,Summary
https://kr.indeed.com/viewjob?jk=3a2b931a41ad9d42 ,Product Manager - Engine Oil Additives,Lubrizol,서울,"growth. Develop, and implement both long- term and short- term product line strategies to ensure that products within..."
https://kr.indeed.com/viewjob?jk=03a58b6646ab9a11 ,HANA Core Developer,SAP,서울,"areas like Transaction processing and Data replication... short term. However, the scope... limited only to them..."
https://kr.indeed.com/viewjob?jk=a03885da3c1030f6 ,Account Director - MediaMonks Korea,MediaMonks,서울,"targets, you’ll help grow business accounts... long- term success for all parties. Please be attentive... position..."
https://kr.indeed.com/viewjob?jk=c895ed610aa7cfd3 ,Account Executive (APAC),Echobox,서울,your region. You... charge of building long- term partnerships with key decision makers at large publishing companies...
https://kr.indeed.com/viewjob?jk=1c720911ecb8f467 ,Cloud Front Sales Manager,Success Korea,서울,forecast and various business reports. - Develop long- term strategic relationships with key accounts. - Ensure customer...
https://kr.indeed.com/viewjob?jk=fb0bb19b300b29ff ,"Sr Account Manager, SK - Amazon Web Serv...",Amazon Web Services Korea LLC,서울,"use... up-front expenses or long- term commitments, making AWS the most cost... Develop long- term strategic relationships..."
https://kr.indeed.com/viewjob?jk=604c8ec90b5c60ce ,Senior Front-end Developer,Asiance,서울,품권 지급 Working from home Leaving work at 4 o'clock on Long- term employee Chuseok & every Wednesday (Flexible) the last Friday...
https://kr.indeed.com/viewjob?jk=7018842f381480e1 ,Pharmacy Sales Representative (4~7년차),Success Korea,서울,based on efficient paper work - Long- term career aspiration fits the organization... paper work - Long- term career aspiration...
https://kr.indeed.com/viewjob?jk=419692b3ddb34768 ,Analytics Specialist,MightyHive,서울,drive long- term value... role focuses... uncover opportunities to drive long- term value Business Facing Project manage...
https://kr.indeed.com/viewjob?jk=48e738d6a6b3e629 ,Material Planner,Dupont,충청남도 천안,contracts or purchase orders. Lead resolution of short- term supply/demand imbalances. Participates in weekly planning...
https://kr.indeed.com/viewjob?jk=6e0b269ca9f710d6 ,Assistant Project Manager_Architecture,Burberry,서울,mindset is core to our business and key to our long- term success. JOB PURPOSE Responsible for co-ordinating and supporting...
https://kr.indeed.com/viewjob?jk=07aaf4e9da9983b0 ,QHSE-S Engineer,제목,인천,Project - Assess Risk Assessment - Any other assigned duties - Term contract (estimated 9 months duration) Essential Criteria...
https://kr.indeed.com/viewjob?jk=61c7c4d0f57e34cd ,"Regional Director, South Korea",University of Maryland Global Campus,대한민국,leaders. Assist... planning and coordinating... annual and term-specific hybrid and F2F schedule of classes. Assist...
https://kr.indeed.com/viewjob?jk=874fb8367ad03070 ,Key Account Manager for EMI Shield,Success Korea,경기도 수원,"term relation at various levels and disciplines, in order to maximize the value (top- and bottom-line) of short & long term..."
https://kr.indeed.com/viewjob?jk=f428b2ce7c5af3c7 ,Business Development Director - MediaMon...,MediaMonks,서울,"targets, you help to grow business accounts... long- term success for all parties. Lastly... role would require you..."
https://kr.indeed.com/viewjob?jk=19944ee0ce69608d ,Scenario Planning Manager,Edwards Korea Ltd,충청남도 천안,role is responsible... review of demand scenarios from short term to long terms... Semiconductor division. Managing...
https://kr.indeed.com/viewjob?jk=fdf3db5d93bf8d0e ,Seeking Motivated Instructor for April S...,Chung Dahm Learning,대구,winter... summer all contracts... minimum one year term E2 sponsorship Requirements... native English...
https://kr.indeed.com/viewjob?jk=96da26ed1ae4b8c8 ,"Sr. Practice Manager, Professional Servi...",Amazon Web Services Korea LLC,서울,disciplined team of direct reports. The PM will develop a long term Professional Services territory strategy and execute...
https://kr.indeed.com/viewjob?jk=4d7abadc31a934a5 ,OEM Sales Manager,Success Korea,서울 상암동,"via price changes or share gain. ? Building strong, long- term customer relationships, based on value... help contribute..."
https://kr.indeed.com/viewjob?jk=5d45a4c7bfb593de ,[해외취업] 플라스틱 사출&무역물류 전문기업 / 회계관리 부문 인턴사원,사이다링크,서울 논현동,your outcome in mind. We strive to create a long term personalized relationship with all our clients by demonstrating premium...
https://kr.indeed.com/viewjob?jk=8e0e48f94e40a586 ,IT Service Mgmt III - (B3),Applied Materials Inc.,대한민국,"self-motivated individual able to build and sustain long- term good relationships with internal customers, colleagues..."
https://kr.indeed.com/viewjob?jk=1d4061cbc7ad9498 ,AR Accountant ( 12 months contract),Richemont,서울,"12 months contract) Richemont Seoul, 11, KR Fixed Term Richemont owns some... world’s leading luxury goods Maisons..."
https://kr.indeed.com/viewjob?jk=cc85973b2bc23208 ,GL accountant ( 12 months contract),Richemont,서울,"12 months contract) Richemont Seoul, 11, KR Fixed Term Richemont owns some... world’s leading luxury goods Maisons..."
https://kr.indeed.com/viewjob?jk=91c6ce9461e58e01 ,Safety Investigations Specialist,Uber,서울,Contribute to building the team... organization for long term success Work closely... regional safety program team...
https://kr.indeed.com/viewjob?jk=85d11141f98e67e4 ,Islamic Charity and Finance Project Mana...,국경없는의사회 한국,서울 강남구,"quantity), cost effective partnerships, and mid/long term development of a strategy... defined entities/circles..."
https://kr.indeed.com/viewjob?jk=21030c2564a66210 ,"Marketing Manager, South Korea",Leica Biosystems,서울,"executes competitive marketing strategies achieving short and long- term revenue growth, ensuring that goals are consistent..."
https://kr.indeed.com/viewjob?jk=b18f41c7cb2b1cb5 ,Booking Coordinator,ZIM,서울,needs Enhancing e-Commerce & e-BK KPI Keying-in long- term/mid- term forecast in Booking Forecast system Reporting daily...
https://kr.indeed.com/viewjob?jk=3ae73b094ebd696b ,Junior Innovation Advisor,Mind the Bridge,대한민국,"strong interpersonal skills and ability to create positive, long- term working relationships by demonstrating a commitment..."
https://kr.indeed.com/viewjob?jk=0be66fd97617e032 ,Hiring Summer Program Instructors,One-Stop Prep,대한민국,provided after successful completion of contracted term. [Housing Support] Company will provide housing stipend...
https://kr.indeed.com/viewjob?jk=b252ad2a65c996c8 ,Clinical Research Associate,Docs Global,서울,provide them with opportunities to develop... long- term career. It takes courage to move from one job to another...
https://kr.indeed.com/viewjob?jk=1b28e89d02afb811 ,[Consumer Health] Korea Supply Chain Hea...,Johnson & Johnson Family of Companies,서울,"oriented and ability to follow through on committed tasks Long- term thinking, innovative & collaborative working Min. fluent..."
https://kr.indeed.com/viewjob?jk=a7cb88f9ccc0cab9 ,Regional Head of Wind Asia,BayWa r.e.,서울,"portfolio of initiatives and programs that ensure BayWa r.e long- term competitiveness. Establish budgets, business plans..."
https://kr.indeed.com/viewjob?jk=d25de9b19acc9f56 ,"Mendix Sales Director, South Korea",Siemens Industry Software Ltd.,서울,"impact... world. So, if you aim high and think long term…you belong here. We innovate. We want... what happens next..."
https://kr.indeed.com/viewjob?jk=8a6f4d217e903742 ,Korea HRBP,KidsLoop,서울,"life balance, autonomous workplace Annual incentive + Long term incentive 15 days of annual leaves + Birthday leave Various..."
https://kr.indeed.com/viewjob?jk=a39a0db2e06d27f6 ,Technical Director,ASM,대한민국,strategic and policy development aspects... have medium term consequences... operation... function and perhaps...
https://kr.indeed.com/viewjob?jk=a2931115ac4ebf8c ,KR_HP_Head of Regulatory Affairs,Boehringer Ingelheim,대한민국,"animals... family owned company, we focus on long- term performance. We believe... we have talented and ambitious..."
https://kr.indeed.com/viewjob?jk=3abf64164bb5734d ,Business Manager,Cepheid,서울,"clinics, college and university student health centers, long term care facilities, STD clinics, urgent care/walk-in clinics..."
https://kr.indeed.com/viewjob?jk=134f1b525a884a4e ,"Specialist, Relationship Management - As...",BNY Mellon,서울,"client, advising... best way to achieve short- and long- term strategic objectives. From a global, bank-wide perspective..."
https://kr.indeed.com/viewjob?jk=3766c0f8acc3f7d8 ,"Victim Advocate, FASS",Magellan Health,대한민국,offending caregivers about the dynamics and possible long- term consequences of child abuse Assess family needs and encourage...
https://kr.indeed.com/viewjob?jk=879e8c5b68e7aff1 ,Product Manager - Engine Oil Additives,Lubrizol Corporation,서울,"growth. Develop, and implement both long- term and short- term product line strategies to ensure that products within..."
https://kr.indeed.com/viewjob?jk=19c2aecc93b3d299 ,Maintenance Engineer (E&I),INEOS Styrolution,대한민국,Review annual shutdown maintenance work plan including 4yr long- term shutdown Perform immediate action for unplanned shutdown...
https://kr.indeed.com/viewjob?jk=68251e47657cb9df ,2021 Call for IBS Young Scientist Fellow...,Institute for Basic Science,대한민국,"research participation in principle. * During the Fellowship term, secondment, joint employment and applying for projects..."
https://kr.indeed.com/viewjob?jk=1d2472440df33e7b ,Tech Business Development Associate,펍지,서울 서초구,"선정 프로세스 지원 파트너쉽 관련 협의/계약 협상 지원 - 당사의 협상력을 높이고 파트너사와 건강한 long- term relationship을 구축할 수 있도록, BD Manager를 지원하여 계약 체결 프로세스 지원 [지원..."
https://kr.indeed.com/viewjob?jk=12c1880eea103442 ,Korean Business Development Manager for...,Yodo1,서울,you great... just closing sales but building long- term client relationships... job... you. *About us...
https://kr.indeed.com/viewjob?jk=1dab8f1b7f3f0a3b ,"Regional Marketing Director, Immuno Derm...",Johnson & Johnson Family of Companies,대한민국,"Pacific customers, as well as guide the short to mid- term commercial strategy for our inline portfolio... require you..."
https://kr.indeed.com/viewjob?jk=5a69760c054926df ,블록체인 개발자 (Dapp)를 찾습니다!,주식회사 핀스프로토콜,서울,talented people who are interested in our Defi's long- term growth. Official Page: https... pynths.com Medium: https...
https://kr.indeed.com/viewjob?jk=61c208177a2c14de ,Senior Operations Manager - Korea,StockX,서울,business teams... develop short- and long- term growth strategies. What you will do Establish team member...
https://kr.indeed.com/viewjob?jk=a3e74aa5a8da761a ,Clinical Research - Translator (Pipeline...,IQVIA,서울,"input. You... part of a global team with exciting long- term career opportunities. So, if you have an entrepreneurial..."
https://kr.indeed.com/viewjob?jk=e9f2e49818b4edd4 ,Hiring Native English Teachers,Ensight Academy,서울 강남구,"exit pay), return flight (upon completion of 2 year full- term) Housing: Provided upon request Days Off: 10 days and extra..."
https://kr.indeed.com/viewjob?jk=fee606d8140aefe3 ,"Recruiting Researcher, Korea",Netflix,서울,"maintain relationships with key talent pools, for short- term and long- term needs As part of a tightly integrated, global..."
https://kr.indeed.com/viewjob?jk=24101c250e0eaf39 ,Sr. Analytics Customer Engagement Specia...,Amazon Web Services Korea LLC,서울,progress and roadblocks to growing the business. · Develop long- term strategic partnerships in support of our strategic...
https://kr.indeed.com/viewjob?jk=19cb085ab3848dc8 ,Account Manager,FARO Technologies,부산광역시,leads and close sales to achieve revenue goals and create long- term purchase agreements with key accounts. Generate sales...
https://kr.indeed.com/viewjob?jk=a1e55ff79d70bd46 ,CIB F&BM - Legal Entity Controller - Ana...,"JPMorgan Chase Bank, N.A.",서울,"drives everything we do. We strive to build trusted, long- term partnerships to help our clients achieve... business..."
https://kr.indeed.com/viewjob?jk=a5939c5d8c5a59d7 ,Talent Acquisition Specialist,Air Liquide,서울,delivering long- term performance... crucial activity to support the long term development of our business. Our team...
https://kr.indeed.com/viewjob?jk=86051b5ff99eb627 ,Application Engineer,Emerson,서울,address customers’ pain points & needs in short & mid- term and connecting them to NPD (New Product Development) funnel...
https://kr.indeed.com/viewjob?jk=8d710489792afed9 ,"Engineering Program Manager (EPM), Korea",Apple,서울,environment. - Preference given to candidates that open to relocation or long term assignment to other Asian country.
https://kr.indeed.com/viewjob?jk=1087bd62f0b0acca ,Production Engineer,Momentive,경기도 화성,"Identifies, communicates and drives implementation of short term modification work Provide necessary training of job, skill..."
https://kr.indeed.com/viewjob?jk=dbbb6f2043df5dfb ,[해외취업] 플라스틱 사출&무역물류 전문기업 / 인사관리 부문 인턴사원,사이다링크,서울 논현동,your outcome in mind. We strive to create a long term personalized relationship with all our clients by demonstrating premium...
https://kr.indeed.com/viewjob?jk=e5734861c6e39637 ,Young Leaders Program-Product Line,Electrolux,서울,"Secure mid/long term product portfolio... Work with team for short- term and long- term planning, P&L projection, financial..."
https://kr.indeed.com/viewjob?jk=22cec4eed54fc335 ,Clinical Trial Assistant,Docs Global,서울,provide them with opportunities to develop... long- term career. It takes courage to move from one job to another...
https://kr.indeed.com/viewjob?jk=3cac25900a93cd09 ,Membership Marketing Director - Korea,Nike,서울,"Brand Creative, Brand Management, and Product— to create a long- term roadmap of projects to optimize and enhance the overall..."
https://kr.indeed.com/viewjob?jk=a9c399327e775745 ,Strategic Client Director (SCD),Oracle,서울,represent a critical strategic investment to create a long- term experience culture and partnership for transformation...
https://kr.indeed.com/viewjob?jk=ac08b39102c21cfc ,Push CD Assistant Manager,Unilever,대한민국,potential new business partners to grow HORECA channel in long term for FOOD Category P rovide supports... Pull Team...
https://kr.indeed.com/viewjob?jk=5ad2ea0313301e31 ,New Business Developer,Glass Substrates for TFT-LCDs,대한민국,development of technology and capabilities to support the long term needs... business -Collaborate... business unit...
https://kr.indeed.com/viewjob?jk=b4a20a783c1bf7a0 ,Account manager,OSIsoft,서울,willing to learn Motivated by results and ultimately long- term customer satisfaction Ability to travel to customer sites...
https://kr.indeed.com/viewjob?jk=08e62a133640c7fc ,Process Research & Development Specialis...,Dow,대한민국,"up activities for new products. Develop short, medium and long term scale-up and manufacturing strategies for new products..."
https://kr.indeed.com/viewjob?jk=78d59703470b554f ,People & Culture Generalist - IKEA Dongb...,IKEA,부산,"through people. You know how to how to implement long- term plans, according to set budgets and goals. You have knowledge..."
https://kr.indeed.com/viewjob?jk=133198269e3fee82 ,CIB - Investment Banking Origination Ass...,"JPMorgan Chase Bank, N.A.",서울,"drives everything we do. We strive to build trusted, long- term partnerships to help our clients achieve... business..."
https://kr.indeed.com/viewjob?jk=91c8c9b1bfdda9bc ,"Engineering Strategic Account Manager, K...",AVEVA,서울,Develop long term relationships... Thinks through and considers the long term cost/benefit implications of change...
https://kr.indeed.com/viewjob?jk=26642e0d0951e3a8 ,Sr. Account Executive,opentext,서울,"revenue and identifying, developing, and maintaining long- term constructive and effective client relationships You are great..."
https://kr.indeed.com/viewjob?jk=5346922408eee45f ,Product Specialist(ASAP),Success Korea,서울 서초구,"implement cohesive sales and marketing plans to pursue long term growth and brand development in Korea ? Select, engage..."
https://kr.indeed.com/viewjob?jk=aed5663324dd0164 ,Mediacom | Media Planning Manager,MediaCom,서울,"Better Results philosophy. Our focus... providing long term, rewarding careers and we know that when we invest in our..."
https://kr.indeed.com/viewjob?jk=48d100d42e2b93e4 ,Tencent Cloud BD Manager,텐센트 코리아,대한민국,"CTOs and CEOs level; Establish, maintain and strengthen long- term excellent relationships with target customers; Developing..."
https://kr.indeed.com/viewjob?jk=a83acc6c2615ad10 ,Enterprise Sales Engineer,Juniper Networks,서울,fosters a long- term business relationship Communicate key issues and advise customers on short-and long- term product...
https://kr.indeed.com/viewjob?jk=de43962f804d7e4e ,"Assistant Campus Director, Osan Campus",Embry-Riddle,경기도 오산,timely completion and submission of registration and end of term actions and student account collections as needed. Maintains...
https://kr.indeed.com/viewjob?jk=6f5f75cc64590508 ,Hiring Instructors,One-Stop Prep,대한민국,provided after successful completion of contracted term. [Housing Support] Company will provide housing stipend...
https://kr.indeed.com/viewjob?jk=47d5c38fcf9e7648 ,Content Marketing Manager,StockX,서울,do Develop a local content strategy aligned with short- term and long- term brand awareness and audience growth targets Work...
https://kr.indeed.com/viewjob?jk=114cdf183befabfc ,UK Strategy Consultant,Crimson Education,서울,"facing responsibilities include driving progress through long- term roadmaps, offering a perspective into UK higher education..."
https://kr.indeed.com/viewjob?jk=5993a6c8f0b70509 ,Digital Media Buyer,Asiance,서울,품권 지급 Working from home Leaving work at 4 o'clock on Long- term employee Chuseok & every Wednesday (Flexible) the last Friday...
https://kr.indeed.com/viewjob?jk=d02e6262640fb9d3 ,"Business Development Manager, Air Condit...",Emerson,서울,"business opportunities, develop and execute short / long term business plans to materialize growth opportunities. Understand..."
https://kr.indeed.com/viewjob?jk=a49794359bd632d7 ,Regional Licensing Manager,"GTC Technology US, LLC",서울,"new business for Sulzer GTC technology sales, building long- term customer relationships, providing technical solutions..."
https://kr.indeed.com/viewjob?jk=f30142e043fa3ae4 ,CRE Partner Sales Manager,Dassault Systèmes,서울,"Capacity Manager... transformation to achieve the Mid- Term Growth Plan, Ensure trusted relationships with Partners..."
https://kr.indeed.com/viewjob?jk=9b166f9dafe73d56 ,Sr. Market Development Specialist,BD,서울,"promotes long term business opportunities, while supporting short term sales cycles... Manage long term projects as like..."
https://kr.indeed.com/viewjob?jk=a997ed73634b048f ,AWS Korea Startup ISR Manager,Amazon Web Services Korea LLC,서울,revenue target · Develop and execute goals to drive long term strategy with startups · Lead the team with engagements...
https://kr.indeed.com/viewjob?jk=add4dbdea57f6d81 ,"Manager II, Geographic Sales",H.B. Fuller,서울,"market trends, uncovering unmet needs, building short & long term business plans... leading the execution... business..."
https://kr.indeed.com/viewjob?jk=fef278e3b64dc225 ,Synthesis Quality Engineer - Liquid Poly...,Dupont,충청남도 천안,"during synthesis, final quality check result and analyze long term quality data to identify opportunity to improve Improve..."
https://kr.indeed.com/viewjob?jk=24a6c8104ca2ca94 ,Security Service_SoC Manager (계약직),IBM,서울,"apparent security breaches •Play a significant role in long- term SOC strategy and planning, including initiatives geared..."
https://kr.indeed.com/viewjob?jk=3bb3b5648ace284c ,Project Manager (Busan),인터커넥션,부산,"appropriately utilized, and short and long term schedules and goals are achieved. Experience with communications..."
https://kr.indeed.com/viewjob?jk=951c850d246f098e ,"Director, Front-end Engineering (Product...",Coupang,서울,"short, mid, and long- term strategies... deliver products. Draft a mid and long- term roadmap to turn Coupang's PC and mobile..."
https://kr.indeed.com/viewjob?jk=f0fa654ed3cffd26 ,"Senior Specialist, Global Key Accounts,...",Adidas,서울,together to achieve customers annual sales plan and set a mid- term plan to grow the both companies business... right...
https://kr.indeed.com/viewjob?jk=515cd9e218bfb136 ,UX Project Manager,Asiance,서울,품권 지급 Working from home Leaving work at 4 o'clock on Long- term employee Chuseok & every Wednesday (Flexible) the last Friday...
https://kr.indeed.com/viewjob?jk=555ec1d49a15770b ,Assistant Director of Sales,"Marriott International, Inc",서울,"related... sales function... focus on building long- term, value-based customer relationships that enable achievement..."
https://kr.indeed.com/viewjob?jk=ec6aac7c2bf8048c ,Product Marketing Manager,Cognex Corporation,서울,"strategic product roadmap... company (e.g., long- term strategic plan) Knowledge, Skills, and Abilities: Excellent..."
https://kr.indeed.com/viewjob?jk=c7cc8468d300361c ,"Senior Manager, Client Engagement",Burberry,서울,mindset is core to our business and key to our long- term success. JOB PURPOSE Senior Client Engagement Manager drives...
https://kr.indeed.com/viewjob?jk=5340876f2f7f70ad ,Marketing Manager - Korea - Field Market...,Aveva,서울,Korea’s business vision for short terms (2-3 year) and longer term (>3 years) Tactical (i.e. Demand/Pipeline Generation...
https://kr.indeed.com/viewjob?jk=cdedbf8b4c337434 ,KR_HP_Compliance Manager,Boehringer Ingelheim,대한민국,"humans and animals... family owned company, we focus on long term performance. We are powered by 50,000 employees globally..."
https://kr.indeed.com/viewjob?jk=b627caef6809bdef ,[Stylenanda] Retail Sales Team Manager,L'Oreal,서울,strategy · Decide to prioritizes according to short/mid/long term business plan · Improve operational procedures to ensure...
https://kr.indeed.com/viewjob?jk=a7fd1998db48f335 ,Salesforce Developer,IQVIA,서울,"time, costs and results Define and implement long- term technical architectures / integrations - sustainable - scalable..."
https://kr.indeed.com/viewjob?jk=dd0b94014e0e01b2 ,Supervisory Human Resources Specialist,US US Army Civilian Human Resources Agency,대한민국,Land & base management Certain current or former term or temporary federal employees of a land or base management agency...
https://kr.indeed.com/viewjob?jk=5d45a4c7bfb593de ,[해외취업] 플라스틱 사출&무역물류 전문기업 / 회계관리 부문 인턴사원,사이다링크,서울 논현동,your outcome in mind. We strive to create a long term personalized relationship with all our clients by demonstrating premium...
https://kr.indeed.com/viewjob?jk=c0d8ea628d928f0d ,Sales Executive,LATOKEN,서울,B2B sales/marketing... entrepreneurship is a big advantage. Long- term belief... future of asset tokenization. Strong...
https://kr.indeed.com/viewjob?jk=60d1990c0bf0e69c ,"NMD Marketing Manager, South Korea",Biogen,서울,ALS product Participate in designing and updating long- term strategic plans Design MKT tactics/materials and implement...
https://kr.indeed.com/viewjob?jk=48e738d6a6b3e629 ,Material Planner,Dupont,충청남도 천안,contracts or purchase orders. Lead resolution of short- term supply/demand imbalances. Participates in weekly planning...
https://kr.indeed.com/viewjob?jk=42be7891a6e593a4 ,[SIMULIA] Sales Expert,Dassault Systèmes,서울,Brand promises to get customer commitment on a long- term business transformation. Role description - Demonstrate value...
https://kr.indeed.com/viewjob?jk=ceef0679e7de33fa ,Brand Manager,Takeda Pharmaceutical,서울,"forecasting long- term and market trend... trend Marketing plan development: long– term business plan, strategic marketing plan..."
https://kr.indeed.com/viewjob?jk=35ada3f7ce6dfb09 ,"People Operations Partner, Busan & Ulsan...",PPG Industries,부산,Manage communication and contract renewal process of fixed term employees. Work... manager... restructuring case...
https://kr.indeed.com/viewjob?jk=0bb37e09d5a2303d ,Field Based Digital Specialist,Amgen,서울,"system, contents and competency of remote detailer Long- term target with virtual engagement for clinic sector, Pharmacy..."
https://kr.indeed.com/viewjob?jk=49220b4afa105236 ,Financial Accountant,Google,서울,"deliverables... name Google came from ""googol,"" a mathematical term... number 1 followed by 100 zeros. And nobody..."
https://kr.indeed.com/viewjob?jk=7fe887442b5d19bf ,Assistant Accountant (Fixed Term Contrac...,BD,서울,General Assistant Accountant with fresh graduated. Job Description KEY RESULT AREAS: (1 year contract) 1 GENERAL...
https://kr.indeed.com/viewjob?jk=86de7094b74c4b25 ,Director of Banquets,Four Seasons,서울,director of banquets is accountable for long- and short- term planning... day-to-day operations of his or her banquet...
https://kr.indeed.com/viewjob?jk=3992e9fb44f365e0 ,"Assoc Spec, Sales",Edwards Lifesciences,서울,"meet sales targets while contributing to development of short- term region plan • Builds and manages strong, long-lasting..."
