Id,Title,Company,Location,Summary
https://kr.indeed.com/viewjob?jk=481bbfa17024b45b ,유럽계글로벌 자동차부품제조사 application engineer 차부장...,에이치알 코리아,대한민국,Support the overall specifc strategy defined to ensure long term sustainable and profitable growth... dedicated customer...
https://kr.indeed.com/viewjob?jk=68b3055cd12e7bf6 ,Financial Analysis Manager,Ecolab,서울,different business division or district Prepare short- term and long- term business plans and strategies with market leadership...
https://kr.indeed.com/viewjob?jk=bcf1caa1318499f8 ,Principal Marketing Business Analysis (M...,Coupang,서울,"data is accessible, readily available for usage. Guide the long- term vision and architecture... data pipelines, data..."
https://kr.indeed.com/viewjob?jk=8c29c1036c738624 ,Commercial Account Executive - Seoul,Datadog,서울,continues to innovate... well positioned... long term. Equal Opportunity at Datadog: Datadog is an Affirmative...
https://kr.indeed.com/viewjob?jk=d7e0bdeef4b7d137 ,HR & Admin Manager,Success Korea,서울 중구,organizational effectiveness (translate long term strategic and short term operational challenges into people related plans...
https://kr.indeed.com/viewjob?jk=51881c46961396ba ,글로벌화장품PR,Success Korea,서울 강남구,채널 화장픔 브랜드) Key Job Accountabilities Develop short- term/ long- term communication strategy and execute strategic PR campaigns...
https://kr.indeed.com/viewjob?jk=7af54571a6a84047 ,Assistant Professor of Computational and...,George Mason University Korea,인천 송도동,"care system, and dependent tuition benefit. The expected term is two years... further opportunity for renewal and multi..."
https://kr.indeed.com/viewjob?jk=e6cacb41e884f03d ,Business Development Manager,AppLovin,서울,partnerships and transforms new opportunities into long term relationships and endurable revenues. Responsibilities: You...
https://kr.indeed.com/viewjob?jk=85b82f0c52a69012 ,INTERN - ECONOMIC AFFAIRS [Temporary],United Nations,인천,commission of any... acts. The term “sexual exploitation” means any actual... conditions. The term “sexual harassment...
https://kr.indeed.com/viewjob?jk=bc74689d9445a7f1 ,"Account Manager, ISV - Amazon Web Servic...",Amazon Web Services Korea LLC,서울,Services as well as best practices implementations · Develop long- term strategic relationships with key accounts... more...
https://kr.indeed.com/viewjob?jk=64ff5323512d4192 ,Alibaba Group-Fliggy Senior Key Account...,Alibaba,서울,profitable long- term partnerships... Able to develop sustainable long- term partnerships internally and externally...
https://kr.indeed.com/viewjob?jk=00a259b1ddbf5788 ,"E-Commerce Opportunities 매니저, 팀장 채용",Success Korea,서울 청담동,business plans that result... establishment of a long term interactive... consumer - Develop a plan and Lead global...
https://kr.indeed.com/viewjob?jk=340896135aabbc46 ,Research&CGT Key account manager,Cytiva,서울,so you can grow your career and expand your skills... long term. Cytiva is proud to work alongside a community of nine...
https://kr.indeed.com/viewjob?jk=a6e571ac46fa84ac ,Mindshare | Digital Planning Manager,Mindshare,서울,Grow team’s strategic capabilities and develop sound long term strategic plans for all the key brands. What you will need...
https://kr.indeed.com/viewjob?jk=a5e4337bd2128bba ,Help Desk Technician,Vision IT,대한민국,"We work side-by-side with our clients as a trusted, long- term partner offering innovative consultation and leadership..."
https://kr.indeed.com/viewjob?jk=cc6a2c70640a9065 ,"Mendix - Enterprise Sales Specialist, So...",Siemens Industry Software Ltd.,서울,"impact... world. So, if you aim high and think long term…you belong here. We innovate. We want... what happens next..."
https://kr.indeed.com/viewjob?jk=5f47555653d7e1b9 ,CIB Operations - Cash Equity Analyst - K...,"JPMorgan Chase Bank, N.A.",서울,"drives everything we do. We strive to build trusted, long- term partnerships to help our clients achieve... business..."
https://kr.indeed.com/viewjob?jk=af803b1792db3c68 ,Business Strategy Consultant (Senior Lev...,IBM,서울,transform the companies. 2. Business development: Build long term client relationship and engage in business development...
https://kr.indeed.com/viewjob?jk=bc15780e7e681ea7 ,"Global Account Executive, Technology (En...",Google,서울,global and regional decision-makers to build and implement long- term digital transformation strategies. Be responsible...
https://kr.indeed.com/viewjob?jk=9fd105e1bebfbfdf ,Services & OS Business Development Manag...,Electrolux,대한민국,Energy – Drive and deliver your roles in a short/long term perspective with strong ownership... profitable growth...
https://kr.indeed.com/viewjob?jk=78e0d9e801c6d9d0 ,Clinical Application Manager APAC,Intuitive,서울,actively invest in our team members to support... long- term growth so they can continue to advance our mission and strive...
https://kr.indeed.com/viewjob?jk=1d248f9fb8119ebc ,외국계 IT 기업 - AE (Account Executive),Success Korea,서울 강남구,line knowledge. - Ability to develop long- term strategic and executive level... develop long- term strategic and executive...
https://kr.indeed.com/viewjob?jk=692d21ba2e496983 ,Marketing Director,Success Korea,서울 양재역,"Responsible for developing and implementing short- term marketing plans and long- term marketing strategies, consistent..."
https://kr.indeed.com/viewjob?jk=83fb57e3ea665e31 ,"Senior Sales Manager, TVHS Channel",Dyson,서울,set up channel plan and long term & short term sales strategy to deliver stable... Vision and Mid- term Business plan...
https://kr.indeed.com/viewjob?jk=e9f73786bed9029d ,Senior Back-End Developer,Asiance,서울,품권 지급 Working from home Leaving work at 4 o'clock on Long- term employee Chuseok & every Wednesday (Flexible) the last Friday...
https://kr.indeed.com/viewjob?jk=fb0bb19b300b29ff ,"Sr Account Manager, SK - Amazon Web Serv...",Amazon Web Services Korea LLC,서울,"use... up-front expenses or long- term commitments, making AWS the most cost... Develop long- term strategic relationships..."
https://kr.indeed.com/viewjob?jk=4d7abadc31a934a5 ,OEM Sales Manager,Success Korea,서울 상암동,"via price changes or share gain. ? Building strong, long- term customer relationships, based on value... help contribute..."
https://kr.indeed.com/viewjob?jk=7018842f381480e1 ,Pharmacy Sales Representative (4~7년차),Success Korea,서울,based on efficient paper work - Long- term career aspiration fits the organization... paper work - Long- term career aspiration...
https://kr.indeed.com/viewjob?jk=b9da8f1bdd289210 ,Key Commodity Manager(third party servic...,Koch Engineered Solutions,서울,continuity plans covering supplier's short- or long- term service disruption in co-ordination with Supplier Relationship...
https://kr.indeed.com/viewjob?jk=96da26ed1ae4b8c8 ,"Sr. Practice Manager, Professional Servi...",Amazon Web Services Korea LLC,서울,disciplined team of direct reports. The PM will develop a long term Professional Services territory strategy and execute...
https://kr.indeed.com/viewjob?jk=b6f5587c81c4f268 ,UI Designer (freelance) - MediaMonks Kor...,MediaMonks,서울,large-scale platforms to mobile apps. You like working on long- term projects and love to get dirty with clean and functional...
https://kr.indeed.com/viewjob?jk=52e86dd51d9d9d2c ,Category Manager,Success Korea,서울 강남구,RESPONSIBILITIES/ACCOUNTABILITIES - Establish and manage a long term product strategy plan for concerned categories. - Define...
https://kr.indeed.com/viewjob?jk=431439f8c81a791b ,Account Manager – HKMC,BorgWarner,대한민국,BW and some activities in relevant industry. Make long- term plan of future market for BW. Responsible for area market...
https://kr.indeed.com/viewjob?jk=3f20a910683d6e8b ,KAO- CHC (=OTC),Success Korea,서울,Co-work with w/s team in BO to control contracted deal term i.e. money collecting - Updating new product launch information...
https://kr.indeed.com/viewjob?jk=f122f176588b5334 ,Senior Solution Sales Executive-ARIBA,SAP,서울,"passionate about customer success, customer delight, and long- term customer relationships Outcome focused... role..."
https://kr.indeed.com/viewjob?jk=a371ac59ee0e10ee ,Help Desk Technician,Vision Information Technology Consultants LLC,대한민국,"We work side-by-side with our clients as a trusted, long- term partner offering innovative consultation and leadership..."
https://kr.indeed.com/viewjob?jk=d3666476bc46dc6e ,KR_HP_National Sales Manager,Boehringer Ingelheim,대한민국,"humans and animals... family owned company, we focus on long term performance. We are powered by 50,000 employees globally..."
https://kr.indeed.com/viewjob?jk=748584801c657a03 ,Executive Technology Partner - Amazon We...,Amazon Web Services Korea LLC,서울,project programs that can achieve long- term outcomes in a scalable and sustainable... goals and long- term technical objectives...
https://kr.indeed.com/viewjob?jk=ffeb7f974a95a956 ,Server Build Technician (Seoul),"SoftLayer Technologies, Inc.",서울,who have 1 year of working experience or related educational qualifications are encouraged to apply Fixed Term Contract
https://kr.indeed.com/viewjob?jk=a02daae0c7cff1ea ,[해외취업] 뉴욕 최대 식품유통 기업 그래픽 디자이너 구인!,아이씨엔그룹,서울 역삼동,marketing managers to establish and renew short and long term strategic design goals. • Communicate with management...
https://kr.indeed.com/viewjob?jk=5993a6c8f0b70509 ,Digital Media Buyer,Asiance,서울,품권 지급 Working from home Leaving work at 4 o'clock on Long- term employee Chuseok & every Wednesday (Flexible) the last Friday...
https://kr.indeed.com/viewjob?jk=e0139146e7d4d4de ,Customer Relations Team Leader - IKEA Gi...,IKEA,경기도 고양,"satisfaction thereby driving sales growth and sustained long- term profitability. • You actively seek, and act on, customer..."
https://kr.indeed.com/viewjob?jk=efc3bbe670d99b23 ,UX Project Director,Asiance,서울,customers... long- term perspective... Reports... Maintain a strong and long- term relationship with clients. Create...
https://kr.indeed.com/viewjob?jk=14c6e7b091b70fb0 ,"Assistant Category Manager, Personal Car...",Dyson,서울,our vision and objectives in short term and long term. Work with Category Manger... work to maximise long term profitability...
https://kr.indeed.com/viewjob?jk=36b518474d4c9f4e ,"Sales, Advanced",Keysight Technologies,서울,maintaining... satisfaction. Maintains positive ongoing long- term relationships with key customers. Proactively acts...
https://kr.indeed.com/viewjob?jk=264c652c5a494bda ,"Account Executive, Enterprise Sales(Manu...",Salesforce,서울,"Executives, Partners etc. Generate short term results whilst maintaining a long term perspective to maximize overall revenue..."
https://kr.indeed.com/viewjob?jk=91cc6b013418f02e ,Brand Manager-Kids Primary Function,Success Korea,서울,assigned marketing projects to achieve annual and long term marketing objectives. 2) Working Relationships - Works closely...
https://kr.indeed.com/viewjob?jk=396e06a87603b588 ,Digital Native channel manager,Oracle,서울,"you. Detailed Description and Job Requirements Builds long term, strategic relationships with named and vertical business..."
https://kr.indeed.com/viewjob?jk=a73b9068922e1543 ,Director of Hospital Marketing and Digit...,Intuitive,서울,actively invest in our team members to support... long- term growth so they can continue to advance our mission and strive...
https://kr.indeed.com/viewjob?jk=5d9ccb303f6c2f18 ,"Senior KA Sales Manager, IVD",Success Korea,서울 강남구,objectives. -Explore more business innovation and make long term business plan. -Responsible for customer group breakthrough...
https://kr.indeed.com/viewjob?jk=2ae127bb2af079d8 ,Community Associate,IWG Careers,서울,"City:Seoul Country:Korea, Republic of Contract Type:Fixed Term Employee Type:Full Time Community Associate At Regus, we’ve..."
https://kr.indeed.com/viewjob?jk=d5e7f3b938205eb6 ,Aftermarket Sales Manager Korea,Nikkiso Cryogenic Industries,경기도 용인,"new customer relationships, ensuring Nikkiso is seen as a long- term business partner Aid prime equipment sales by maintaining..."
https://kr.indeed.com/viewjob?jk=0049e64a61fecda5 ,IMC- PR Mgr,Success Korea,서울 강남구,자격요건 담당직무 1.Draft and develop competitive short & long term digital strategy 2. Improve digital media spending effectiveness...
https://kr.indeed.com/viewjob?jk=670ba63e5ac61687 ,Technical Consultant,Elanco,서울,"goal of linking Elanco, products and services... long term business needs... accounts. Co-ordinate with colleagues..."
https://kr.indeed.com/viewjob?jk=cb449f6a68369d9c ,"Sales Director, Korea",Illumina,서울,sales agreements. Strong desire to win business and establish long term customer relationships. Excellent time management...
https://kr.indeed.com/viewjob?jk=d1d9931658bcc38c ,Manager People & Culture - Operations Ya...,Philip Morris International,대한민국,DAY’ • Strategy Development & Deployment - Ensure long term P&C Strategic Priorities are defined and agreed with respective...
https://kr.indeed.com/viewjob?jk=834446f082f8bd90 ,Business Development Manager,Success Korea,서울,plans based upon business strategy... significant mid- term impact on business unit overall results. ? May lead important...
https://kr.indeed.com/viewjob?jk=f8e5f3a41466e453 ,Sales Development Representative,DataDog,서울,continues to innovate... well positioned... long term. Equal Opportunity at Datadog: Datadog is an Affirmative...
https://kr.indeed.com/viewjob?jk=149f1a88fd33cee6 ,프로젝트 코디네이터 (Onsite 프리랜서),Hogarth Worldwide,서울,transfer launch assets to long- term Digital Asset system Assist Content PM... upcoming short- term projects...
https://kr.indeed.com/viewjob?jk=d6026a1db9c8ca31 ,[Global Biz Dev Div] Tech Business Devel...,PUBG,서울,"선정 프로세스 지원 파트너쉽 관련 협의/계약 협상 지원 당사의 협상력을 높이고 파트너사와 건강한 long- term relationship을 구축할 수 있도록, BD Manager를 지원하여 계약 체결 프로세스 지원 자격..."
https://kr.indeed.com/viewjob?jk=e4efb05bff0fdb31 ,"Business Development specialist , Interv...",Success Korea,서울 강남구,industry trends... impact on franchise short- term and long- term business plans to improve marketing and sales...
https://kr.indeed.com/viewjob?jk=9c90f26d2e1b6497 ,[FT&PT] Hiring Summer Program Instructor...,One-Stop Prep,서울 압구정역,provided after successful completion of contracted term. [Housing Support] Company will provide housing stipend...
https://kr.indeed.com/viewjob?jk=36f71e01a8d80aa8 ,Account Executive II (부장급),Success Korea,서울,skills. 8. Ability to develop long- term strategic and executive level relationships... develop long- term strategic and executive...
https://kr.indeed.com/viewjob?jk=716c453c7acae35a ,Sales Planning Manager,Success Korea,대한민국,status. 2)Annual Sales Planning & Budget Planning based on Mid- term plan and market status. 3)New Business project planning...
https://kr.indeed.com/viewjob?jk=dcaca86393afc521 ,eCommerce Team Manager (+10 years),Success Korea,서울,eCommerce Sales Strategy Development Develop Short- term / Long- term eCom business plan and strategies Develop integrated...
https://kr.indeed.com/viewjob?jk=802d5efc4b626a3f ,"Manager, Life Science Solutions Group (S...",Thermo Fisher Scientific,서울,Group Strategy will support Thermo Fisher Scientific’s long- term Life Science Solution Group strategy development efforts...
https://kr.indeed.com/viewjob?jk=ed670966662d799f ,작업 디자이너 (Onsite 프리랜서),Hogarth Worldwide,서울,원어민이나 영어를 잘하시는 분 매우 선호합니다... vacancy... upcoming short- term projects... happen intermittently from July/August...
https://kr.indeed.com/viewjob?jk=a03885da3c1030f6 ,Account Director - MediaMonks Korea,MediaMonks,서울,"targets, you’ll help grow business accounts... long- term success for all parties. Please be attentive... position..."
https://kr.indeed.com/viewjob?jk=874fb8367ad03070 ,Key Account Manager for EMI Shield,Success Korea,경기도 수원,"term relation at various levels and disciplines, in order to maximize the value (top- and bottom-line) of short & long term..."
https://kr.indeed.com/viewjob?jk=3bb031f95312c279 ,"Principal, Back end Engineer (Service an...",Coupang,서울,diving deep to solve them. Plan and execute on a long term roadmap to grow domain systems in a scalable and stable manner...
https://kr.indeed.com/viewjob?jk=68e584fc44c1d706 ,"Sales Executive (차,부장급)",Success Korea,대한민국,presentation and negotiation skills. - Ability to develop long- term strategy with customer. [자격요건] - 관련분야 경력 10~15년 - 학사 이상...
https://kr.indeed.com/viewjob?jk=890e2da4690f09e9 ,Telecommunications Engineering Specialis...,Barbaricum,경기도 평택,"objectives... clearly defined near- term, mid- term, and long- term initiatives. Qualifications Active DoD Secret..."
https://kr.indeed.com/viewjob?jk=fb0bb19b300b29ff ,"Sr Account Manager, SK - Amazon Web Serv...",Amazon Web Services Korea LLC,서울,"use... up-front expenses or long- term commitments, making AWS the most cost... Develop long- term strategic relationships..."
https://kr.indeed.com/viewjob?jk=b136ac78e92e8839 ,Inside Sales Account Mgmt III (과장급),Success Korea,서울,multiple stakeholders. - Effectively balances short term and long term priorities. - Develops and implements account plans...
https://kr.indeed.com/viewjob?jk=16aa6fcd7d8c4f78 ,Senior Partner Solutions Architect - Dat...,Amazon Web Services Korea LLC,서울,"build complex, AWS-optimized architectures, and develop a long- term strategy with AWS business development and service teams..."
https://kr.indeed.com/viewjob?jk=35557823eda0431d ,Inside Sales Account Mgmt II (대리급),Success Korea,서울,multiple stakeholders. - Effectively balances short term and long term priorities. - Develops and implements account plans...
https://kr.indeed.com/viewjob?jk=396ad32b5af8310f ,Hiring FT&PT Summer Program Instructors,One-Stop Prep,대한민국,provided after successful completion of contracted term. [Housing Support] Company will provide housing stipend...
https://kr.indeed.com/viewjob?jk=29ec70525e309417 ,글로벌 E-Commerce 팀장 채용,Success Korea,서울 강남구,business plans that result... establishment of a long term interactive... consumer - Develop a plan and Lead global...
https://kr.indeed.com/viewjob?jk=e1943cc89efb922b ,Service Engineer (RSC),Success Korea,서울,"repair, troubleshooting, etc.) - Onsite support for long- term projects inside and outside of Korea - Technical indoor support..."
https://kr.indeed.com/viewjob?jk=feb1b1346ea01166 ,Teller,US Defense Commissary Agency,대한민국,Land & base management Certain current or former term or temporary federal employees of a land or base management agency...
https://kr.indeed.com/viewjob?jk=f1c50a8d6e97b0cb ,"Team Lead, Authentication & Quality Assu...",StockX,서울,aligned... near term and future... teams... develop short and long- term growth strategies. What you will do...
https://kr.indeed.com/viewjob?jk=141de932f84eadb7 ,Senior AE (MBU) 모집,Success Korea,서울 강남구,our customers in ways that would lead to long term business relationships and long term business growth ? Review customers...
https://kr.indeed.com/viewjob?jk=a26747f459e2e958 ,Partner Growth Manager,Infobip,서울,region... accountable for securing short and long- term profitable business... company by developing the existing...
https://kr.indeed.com/viewjob?jk=eb7c2ad108586b4d ,Plant Controller,OWENS CORNING,충청남도,"Customer Focus Work Standards / Quality Contributing to Team Success MS office, English, Finance and Accounting term"
https://kr.indeed.com/viewjob?jk=3992e9fb44f365e0 ,"Assoc Spec, Sales",Edwards Lifesciences,서울,"meet sales targets while contributing to development of short- term region plan • Builds and manages strong, long-lasting..."
https://kr.indeed.com/viewjob?jk=6f5f75cc64590508 ,Hiring Instructors,One-Stop Prep,대한민국,provided after successful completion of contracted term. [Housing Support] Company will provide housing stipend...
https://kr.indeed.com/viewjob?jk=f1888a7d1de04876 ,"Field Marketing Manager, Japan and Korea",Remerge,서울,need. Office Exchange: travel to our global offices for short term assignments. Team Events : celebrate achievements and live...
https://kr.indeed.com/viewjob?jk=e64d2f1e2de938b4 ,Solutions Architect,Amazon Web Services Korea LLC,서울,managers within your larger organization when discussing mid- term customer strategy and architectural best practices · We...
https://kr.indeed.com/viewjob?jk=a1e55ff79d70bd46 ,CIB F&BM - Legal Entity Controller - Ana...,"JPMorgan Chase Bank, N.A.",서울,"drives everything we do. We strive to build trusted, long- term partnerships to help our clients achieve... business..."
https://kr.indeed.com/viewjob?jk=e2372b6026274042 ,실시간 온라인과외앱 스냅애스크 Customer Success Manage...,유한회사 스냅애스크,서울 강남구,development and performance- Establish and maintain long term rapport with students and parents- Handle business operations...
https://kr.indeed.com/viewjob?jk=10459a950efb408f ,Materials Handler (Fork Lift Operator),US Defense Commissary Agency,대한민국,Land & base management Certain current or former term or temporary federal employees of a land or base management agency...
https://kr.indeed.com/viewjob?jk=5fd5465ca0a9de05 ,[Roger Dubuis] Brand Manager,Roger Dubuis,서울,"highly skilled individuals - In line... Brand’s long- term strategy, develop sales and distribution strategies for Roger..."
https://kr.indeed.com/viewjob?jk=295ffdd2c1fe2e55 ,Global Marketing Director - Electronics,Momentive,서울,"has been leading the way in providing long- term, reliable protection for sensitive... short and long term focus market segment..."
https://kr.indeed.com/viewjob?jk=6f3222a775043285 ,Seeking Motivated Instructor for April D...,Chung Dahm Learning,부산광역시,winter... summer all contracts... minimum one year term E2 sponsorship Requirements... native English...
https://kr.indeed.com/viewjob?jk=68372492c5adde88 ,"Sales Account Manager, Korea",Ascend Performance Materials,서울,Pursue and deliver sustainable growth to achieve short- term and mid- term commercial objectives Maintain relationship...
https://kr.indeed.com/viewjob?jk=5346922408eee45f ,Product Specialist(ASAP),Success Korea,서울 서초구,"implement cohesive sales and marketing plans to pursue long term growth and brand development in Korea ? Select, engage..."
https://kr.indeed.com/viewjob?jk=60de0e9b1fcb4935 ,Medical Science Liaison (Respiratory),Boehringer Ingelheim,대한민국,"humans and animals... family owned company, we focus on long term performance. We are powered by 50,000 employees globally..."
https://kr.indeed.com/viewjob?jk=016d961e56b4f022 ,Wedding Sales Executive (Fairmont Ambass...,FAIRMONT,서울 영등포구,"function... wedding and social event focus on building long- term, value-based customer relationship to achieve and exceed..."
https://kr.indeed.com/viewjob?jk=6baf28bb7c303117 ,"Senior Manager, Business Development",Klook,서울,"suppliers, and create merchant success plans for long term sustainable partnership. Provide training and daily operational..."
https://kr.indeed.com/viewjob?jk=5a844f6265795c09 ,APAC Enablement Lead - Tech Cloud,Oracle,서울,"Detailed Description and Job Requirements Builds long term, strategic relationships with named and vertical business..."
https://kr.indeed.com/viewjob?jk=236b08159f660107 ,"Security Strategist Lead, Korea",Amazon Web Services Korea LLC,서울,develop long- term projects and define... necessary. - Develop and execute long- term regulatory projects and initiatives...
https://kr.indeed.com/viewjob?jk=43bf0c7e2b10e9b5 ,Operations Manager (운영팀장) - 한국,Beam,서울,highly adaptable candidate who is able to switch between long- term strategic initiatives one moment and pivot into rapid...
https://kr.indeed.com/viewjob?jk=4b89c6620ea1b3c5 ,Market Development Manager,Integrated DNA Technologies (IDT),부산광역시,analyze and track trends that may impact the short and long- term needs of addressable markets. Conduct competitive research...
https://kr.indeed.com/viewjob?jk=27587452fdafb720 ,Tencent Cloud Business Development Manag...,Tencent,서울,"CEOs level. 3. Establish, maintain and strengthen long- term excellent relationships with target customers. 4. Developing..."
https://kr.indeed.com/viewjob?jk=06337f101f609e71 ,"Strategic Marketing Manager, Genetic Sci...",Thermo Fisher Scientific,서울,planning on a regular basis Coordinate the short- term & long- term business strategy based on market insights and assumptions...
https://kr.indeed.com/viewjob?jk=61c290bc83dd2dca ,Group Product Manager (부장급),Success Korea,서울 여의도역,Main responsibility: Contribute to achieve short & long term sales/profit and brand growth by establishing & implementing...
https://kr.indeed.com/viewjob?jk=f85432aa9863b62b ,Senior AE (EBU HF) 모집,Success Korea,서울 강남구,our customers in ways that would lead to long term business relationships and long term business growth - Review customers...
https://kr.indeed.com/viewjob?jk=3bc474d47b79103c ,Associate Directorship at IBS Center for...,MathHire.org,대전,position - All candidates must be able to make a long- term commitment to IBS-CGP’s research activities. - All candidates...
