Id,Title,Company,Location,Summary
https://kr.indeed.com/viewjob?jk=53ac91b10e7daa08 ,Service Sales Manager - Turbomachinery &...,Baker Hughes,경기도 성남,"solutions, long- term contract conditions and management of internal stakeholders Building long- term strategic relationships..."
https://kr.indeed.com/viewjob?jk=424efc3524217e25 ,외국계 상용차 재무기획(차장급),Success Korea,경기도 용인,have a responsibility of company strategy for both short- term and long- term... Directly report to controller for various...
https://kr.indeed.com/viewjob?jk=691abd88553b0e92 ,Supply Chain Operations Specialist,Moderna,서울,Planner. Collaborate... CMO Planner... management of short- term schedule changes. Provide feasibility assessments...
https://kr.indeed.com/viewjob?jk=e52e3ebc2fe615e3 ,SCM Auditor,DNV,서울,"support our customers to transition and realize... long- term strategic goals sustainably, and collectively contributing..."
https://kr.indeed.com/viewjob?jk=642c35a7faea9033 ,OTC&Healthcare사업실 마케터 모집,한독약품,서울,"Lead development of annual, and long term brand/business planning to achieve volume... short and long term business objectives..."
https://kr.indeed.com/viewjob?jk=4e2911b1e59a9a21 ,Korea Service Ambassador - Internship,Cytiva,서울,so you can grow your career and expand your skills... long term. Cytiva is proud to work alongside a community of nine...
https://kr.indeed.com/viewjob?jk=3f20a910683d6e8b ,KAO- CHC (=OTC),Success Korea,서울,Co-work with w/s team in BO to control contracted deal term i.e. money collecting - Updating new product launch information...
https://kr.indeed.com/viewjob?jk=ed242677d8f12463 ,Marketing Manager (차-부장급),Success Korea,서울 여의도역,"drive world class implementation to achieve long-, mid- and short term objectives... brands [자격요건] - 10~13 years of work..."
https://kr.indeed.com/viewjob?jk=16aa6fcd7d8c4f78 ,Senior Partner Solutions Architect - Dat...,Amazon Web Services Korea LLC,서울,"build complex, AWS-optimized architectures, and develop a long- term strategy with AWS business development and service teams..."
https://kr.indeed.com/viewjob?jk=c85a582c271219e3 ,"Manager, Business Development",Klook,서울,"suppliers, and create merchant success plans for long term sustainable partnership. Provide training and daily operational..."
https://kr.indeed.com/viewjob?jk=e4efb05bff0fdb31 ,"Business Development specialist , Interv...",Success Korea,서울 강남구,industry trends... impact on franchise short- term and long- term business plans to improve marketing and sales...
https://kr.indeed.com/viewjob?jk=eb36d335fefa479d ,"Engineering Strategic Account Manager, K...",Aveva,서울,Develop long term relationships... Thinks through and considers the long term cost/benefit implications of change...
https://kr.indeed.com/viewjob?jk=5cfdc75d168506fc ,KR_HP_Medical Science Liaison (Respirato...,Boehringer Ingelheim,대한민국,"animals... family owned company, we focus on long- term performance. We believe... we have talented and ambitious..."
https://kr.indeed.com/viewjob?jk=f096f5f3af0f3510 ,"Director, Instock & Returns FP&A",Coupang,서울,based... current status of your team and provide short- term targets for your team to achieve. Analyze Data and Reporting...
https://kr.indeed.com/viewjob?jk=b9da8f1bdd289210 ,Key Commodity Manager(third party servic...,Koch Engineered Solutions,서울,continuity plans covering supplier's short- or long- term service disruption in co-ordination with Supplier Relationship...
https://kr.indeed.com/viewjob?jk=27587452fdafb720 ,Tencent Cloud Business Development Manag...,Tencent,서울,"CEOs level. 3. Establish, maintain and strengthen long- term excellent relationships with target customers. 4. Developing..."
https://kr.indeed.com/viewjob?jk=6e24b33050e74f56 ,"10 hrs/week TEFL PT, Mon & Wed, phonics,...",E-Top English Academy,서울 종로구,"MYUNG UNIVERSITY.] 35 000 won/teaching hour + INCENTIVE Long term F-visa Schedule -Monday, Wednesday: 3~8pm (3 groups, 5..."
https://kr.indeed.com/viewjob?jk=431439f8c81a791b ,Account Manager – HKMC,BorgWarner,대한민국,BW and some activities in relevant industry. Make long- term plan of future market for BW. Responsible for area market...
https://kr.indeed.com/viewjob?jk=1da54961bc3ed063 ,"Associate Manager, Business Development",Klook,서울,"suppliers, and create merchant success plans for long term sustainable partnership. Provide training and daily operational..."
https://kr.indeed.com/viewjob?jk=19944ee0ce69608d ,Scenario Planning Manager,Edwards Korea Ltd,충청남도 천안,role is responsible... review of demand scenarios from short term to long terms... Semiconductor division. Managing...
https://kr.indeed.com/viewjob?jk=890e2da4690f09e9 ,Telecommunications Engineering Specialis...,Barbaricum,경기도 평택,"objectives... clearly defined near- term, mid- term, and long- term initiatives. Qualifications Active DoD Secret..."
https://kr.indeed.com/viewjob?jk=834446f082f8bd90 ,Business Development Manager,Success Korea,서울,plans based upon business strategy... significant mid- term impact on business unit overall results. ? May lead important...
https://kr.indeed.com/viewjob?jk=f8d919ed86054fde ,Account Manager,Success Korea,서울,벌회사) 업무내용/자격요건 담당직무 -You build and further develop strong long- term relationships with our advertising partners -You monitor...
https://kr.indeed.com/viewjob?jk=ea0c2fd84510e26c ,Sales Engineer and Area Manager for Kore...,Opto Engineering,서울,등) 사이의 인터페이스 역할 Your responsibilities: build and develop long- term relationships with customers within a defined sales area...
https://kr.indeed.com/viewjob?jk=55d856d12c2156ca ,Senior Full-stack Developer,Asiance,서울,품권 지급 Working from home Leaving work at 4 o'clock on Long- term employee Chuseok & every Wednesday (Flexible) the last Friday...
https://kr.indeed.com/viewjob?jk=6d884233e3297751 ,"Sr Solutions Architect, Industrial",Amazon Web Services Korea LLC,대한민국,"demonstrate the ability to think strategically and long- term about the needs of global businesses, financial implications..."
https://kr.indeed.com/viewjob?jk=fd050288a3df5cb0 ,Ad Operations Manager APAC,Remerge,서울,Office Exchange: travel to our global offices for short term assignments. Team Events : celebrate achievements and live...
https://kr.indeed.com/viewjob?jk=defa5ee3fc93e2ad ,Producer,Tilting Point,서울,"drive development cycles, balancing out short- term needs and long- term vision. Ability to adapt... effective in new..."
https://kr.indeed.com/viewjob?jk=dcad06652d9d8afc ,Assistant Brand Manager,Success Korea,서울 종로구,"each campaign * Develop long term brand, category & platform strategies and short term tactics to meet business goals..."
https://kr.indeed.com/viewjob?jk=d28bcabb8d0a46a1 ,KR_AH_Local Sales Manager (Temp.),Boehringer Ingelheim,대한민국,"humans and animals... family owned company, we focus on long term performance. We are powered by 50,000 employees globally..."
https://kr.indeed.com/viewjob?jk=38fbc85374b28767 ,"Principal, Back end Engineer (Core Produ...",Coupang,서울,담당하는 도메인 시스템을 확장성있고 안정적으로 발전시키기 위한 long- term roadmap을 계획하고 실행 Business와 Tech 사이에서... execute on a long term roadmap to grow...
https://kr.indeed.com/viewjob?jk=1cd6d0ddae997754 ,Commercial Account Executive,DataDog,서울,continues to innovate... well positioned... long term. Equal Opportunity at Datadog: Datadog is an Affirmative...
https://kr.indeed.com/viewjob?jk=f6e2f74de65bf14c ,"Business Development Manager, Games",Epic Games,서울,"We offer coverage for Medical, Dental, Vision HRA, Long Term Disability, AD&D and Life Insurance, 401k. All Epic employees..."
https://kr.indeed.com/viewjob?jk=ed75832e441ec27d ,Snr Technical Support Engineer,ASM,대한민국,internal and external stakeholders. Understand and build long- term innovative global technology systems that enable enhanced...
https://kr.indeed.com/viewjob?jk=684f2d1a3bf61902 ,GroupM | Junior Programmatic Trading Man...,Xaxis,서울,levers You... able to develop supporting & long- term relationships with all your designated media buying agencies...
https://kr.indeed.com/viewjob?jk=9f8624e1e7e6d785 ,"Senior Solution Engineer , Seoul",VMware System Engineering,서울,want to work long term by living our... closely with sales to build long- term business relationships within the Samsung...
https://kr.indeed.com/viewjob?jk=5b53280ec195fde3 ,"Account Strategist, Mid-Market Sales (Ko...",Google,서울,"critical growth engine for customers in GCS. Through long- term relationship development, we are dedicated to understanding..."
https://kr.indeed.com/viewjob?jk=eeee68d268934495 ,PM(Project Management),Success Korea,대한민국,Job Development & Utilization Short- Term Plan (2~3 years) - SAIT102 Programme... Utilization Short- Term Plan (2~3 years...
https://kr.indeed.com/viewjob?jk=5863a236412d344b ,"Head of Partners and Alliances, Google C...",Google,서울,term direction and results. Work collaboratively... rest of Google Cloud and other Google teams in delivering long- term...
https://kr.indeed.com/viewjob?jk=b77aace008423ec4 ,"Field Sales Representative, Looker",Google,서울,"maintain executive relationships with customers, consult long- term strategic direction, and act as a trusted advisor. Help..."
https://kr.indeed.com/viewjob?jk=51b01ccc49d7488e ,Theme Park Business Developer,Theme Park N Attractions,경기도 용인,"multi-national amusement/theme park companies Contract Term: 2yrs, but renewable. Compensation: Very competitive (Negotiable..."
https://kr.indeed.com/viewjob?jk=8e5840177aa7af82 ,Corporate & Investment Bank_Credit Risk...,"JPMorgan Chase Bank, N.A.",서울,"familiarity with term sheets / loan... do. We strive to build trusted, long- term partnerships to help our clients achieve..."
https://kr.indeed.com/viewjob?jk=601b93c0bb5f7a71 ,Logistics Sales Engineer,Cognex Corporation,서울,who... using Cognex’s logistics products. Build long- term relationships with OEMs and End Users that enable year over...
https://kr.indeed.com/viewjob?jk=d4403c9aa0da3ead ,May 14th ESL Full & Part Time,ESL AGENT,대한민국,"Songdo, Incheon 2. Teaching level: Elementary (5 position) 3. Term of Employment: June 14th ~ Aug.20th 4. Working hours: 9:30..."
https://kr.indeed.com/viewjob?jk=c7d6d7641f398d6d ,Regional Director (APAC),Echobox,서울,your region. You... charge of building long- term partnerships with key decision makers at large publishing companies...
https://kr.indeed.com/viewjob?jk=1ff7e8b6a54b47a2 ,Insight & Planning Manager,Success Korea,서울 삼성역,insights & planning agenda 1. Help develop the medium to long term strategies to achieve business goals... Develop where...
https://kr.indeed.com/viewjob?jk=0c03624a78275989 ,"Partner Development Manager, ISV Startup...",Amazon Web Services Korea LLC,서울,"Sell... GTM activities and create/ maintain a long- term, scalable joint GTM model that drives partner and customer..."
https://kr.indeed.com/viewjob?jk=2113e13e64ecc50e ,"Country Manager, Seoul","Pixelogic Media Partners, LLC",서울,vision and actively participate... company’s short and long term strategic planning activities. Represent the company...
https://kr.indeed.com/viewjob?jk=68372492c5adde88 ,"Sales Account Manager, Korea",Ascend Performance Materials,서울,Pursue and deliver sustainable growth to achieve short- term and mid- term commercial objectives Maintain relationship...
https://kr.indeed.com/viewjob?jk=671808bd8dcbf9d9 ,2021 Call for IBS Young Scientist Fellow...,"Institute for Basic Science, IBS",대전,"research participation in principle * During the Fellowship term, secondment, joint employment and applying for projects..."
https://kr.indeed.com/viewjob?jk=4fc4925f00abf44c ,"Account Executive, Marketing Cloud Korea",Salesforce,서울,"Executives, Partners etc. Generate short term results whilst maintaining a long term perspective to maximize overall revenue..."
https://kr.indeed.com/viewjob?jk=a6e571ac46fa84ac ,Mindshare | Digital Planning Manager,Mindshare,서울,Grow team’s strategic capabilities and develop sound long term strategic plans for all the key brands. What you will need...
https://kr.indeed.com/viewjob?jk=36f71e01a8d80aa8 ,Account Executive II (부장급),Success Korea,서울,skills. 8. Ability to develop long- term strategic and executive level relationships... develop long- term strategic and executive...
https://kr.indeed.com/viewjob?jk=b6f5587c81c4f268 ,UI Designer (freelance) - MediaMonks Kor...,MediaMonks,서울,large-scale platforms to mobile apps. You like working on long- term projects and love to get dirty with clean and functional...
https://kr.indeed.com/viewjob?jk=91cc6b013418f02e ,Brand Manager-Kids Primary Function,Success Korea,서울,assigned marketing projects to achieve annual and long term marketing objectives. 2) Working Relationships - Works closely...
https://kr.indeed.com/viewjob?jk=61c290bc83dd2dca ,Group Product Manager (부장급),Success Korea,서울 여의도역,Main responsibility: Contribute to achieve short & long term sales/profit and brand growth by establishing & implementing...
https://kr.indeed.com/viewjob?jk=1a77eef8e6d5418b ,[급] Category Insights Manager,Success Korea,서울 광화문역,business teams through Business Planning (both long- term + annual) process.? - Define the annual consumer understanding...
https://kr.indeed.com/viewjob?jk=3bb031f95312c279 ,"Principal, Back end Engineer (Service an...",Coupang,서울,diving deep to solve them. Plan and execute on a long term roadmap to grow domain systems in a scalable and stable manner...
https://kr.indeed.com/viewjob?jk=d4157a64fa8fea96 ,Marketing Manager,Guided Solutions,서울,research and analysis and make recommendations... long term strategies Develop structured training tools for sales...
https://kr.indeed.com/viewjob?jk=416c089694c80e6e ,Account Manager,BD,서울,"financial goals... business. Develop short- term and long- term sales strategy, execute sales plans through to launch..."
https://kr.indeed.com/viewjob?jk=f1b4e7eabc2da592 ,Associate Vet Affair Manager (학술팀 팀장),Success Korea,서울 삼성역,prioritized in order to maximize impact on short / long term BRMO. Principal Duties and Responsibilities ? Manages...
https://kr.indeed.com/viewjob?jk=2a809f8ef919aec1 ,Corporate Business Development & Strateg...,Success Korea,서울 서초동,joint ventures... 3) assisting... development of long- term strategy for RNTS divisions which include mobile platforms...
https://kr.indeed.com/viewjob?jk=b73d005e680278ba ,"Accounting Supervisor, Credit & AR Colle...",Thermo Fisher Scientific,서울,"customers’ financial status and set up credit limit, payment term on a regular basis. Evaluate collateral value and check..."
https://kr.indeed.com/viewjob?jk=1289245f63a53089 ,"Head of Industry Verticals, AWS Korea",Amazon Web Services Korea LLC,서울,"Responsibilities: · Develop the short, medium, and long term Korea Enterprise account/sales plan and drive revenue and market..."
https://kr.indeed.com/viewjob?jk=80177c77e3ff6abf ,Assistant Finance Manager(대리-과장급),Success Korea,서울 서울역,Reconciling payroll taxes and employee insurances -Long term deposit payables & customer credit management -AR collection...
https://kr.indeed.com/viewjob?jk=45c80ab602aa2d94 ,Senior Principal Software Engineer / Arc...,Coupang,서울,Cloud Native. You will develop a long- term roadmap to manage and improve this large... implement a mid/long term roadmap...
https://kr.indeed.com/viewjob?jk=1c9eff526f40bc59 ,"Account Manager, OEM Solutions Business...",Trimble,서울,exploring new horizons and building long term OEM partnerships. We work together... develop long- term business partnerships...
https://kr.indeed.com/viewjob?jk=aa4f8a29ba176412 ,Technical Account Manager,Sumo Logic,서울,value out of Sumo Logic and understanding a vision for long term success and growth. You... main point of contact...
https://kr.indeed.com/viewjob?jk=5ade5fe5275e7454 ,"Manager, Customer Excellence – Digital O...",Thermo Fisher Scientific,서울,within team. Set short- term and long- term team goals. Formulate strategy to achieve... short and long- term objectives. Drives...
https://kr.indeed.com/viewjob?jk=f9e7028161fe58e5 ,Emerging Channel Team Leader (부장급),Success Korea,서울 강남구,e-commerce sales program - Develop and execute short & long- term e-commerce strategy and roadmap - Updates e-commerce market...
https://kr.indeed.com/viewjob?jk=7363f826593542e4 ,Brand Manager (4~7 years),Success Korea,서울 여의도역,Capabilities - annual & mid-long term business planning - analytic skills... annual & mid-long term business planning...
https://kr.indeed.com/viewjob?jk=4be74e4e0f632de0 ,"Technical Marketing Manager, Memory Segm...",Cabot Microelectronics,경기도 수원,strategic customers. • Support corporate level near- term and longer- term market assessment and strategy development as needed...
https://kr.indeed.com/viewjob?jk=d1e22359dad4c1a1 ,Sr. Business Development Mgr.,Honeywell,서울,"opportunities, and develop and manage... become long- term users of Tridium’s products. Primary customer interface..."
https://kr.indeed.com/viewjob?jk=04bed05fc1b3b740 ,HR Manager채용,Success Korea,서울 강남구,law; - Develop HR plans... CEO to ensure short- and long- term staff requirements; - Provide effective induction...
https://kr.indeed.com/viewjob?jk=f5efe4d20645e786 ,Clinical Trial Educator (fixed-term),IQVIA,서울,Job Overview CTEs collaborate with research staff and other stakeholders to drive trial recruitment... support study...
https://kr.indeed.com/viewjob?jk=9189e63d57b1a9bc ,Cloud Application Architect,IBM,서울,technical recommendations or decisions Form and grow long- term trusted advisor relationships with clients Share your...
https://kr.indeed.com/viewjob?jk=d23815174aedbafa ,"Senior Sales Manager, EM Channel",Dyson,서울,set up GTM plan and long term & short term sales strategy to deliver stable sales... Vision and Mid- term Business plan...
https://kr.indeed.com/viewjob?jk=19944ee0ce69608d ,Scenario Planning Manager,Edwards Korea Ltd,충청남도 천안,role is responsible... review of demand scenarios from short term to long terms... Semiconductor division. Managing...
https://kr.indeed.com/viewjob?jk=b076ec40cced7829 ,Senior UX Designer,Asiance,서울,품권 지급 Working from home Leaving work at 4 o'clock on Long- term employee Chuseok & every Wednesday (Flexible) the last Friday...
https://kr.indeed.com/viewjob?jk=a83acc6c2615ad10 ,Enterprise Sales Engineer,Juniper Networks,서울,fosters a long- term business relationship Communicate key issues and advise customers on short-and long- term product...
https://kr.indeed.com/viewjob?jk=de0d21966a3ee254 ,"Field Sales Representative, Enterprise,...",Google,서울,"relationships with enterprise customers. Influence long- term strategic direction, and serve as a business partner. Negotiate..."
https://kr.indeed.com/viewjob?jk=c1692784e29fd96d ,"CSI Manager(Claim, Standard and Insights...",Dyson,서울,"creativity, innovation and ambition... fixed term contract for 12 months. #LI-DYSON Interview guidance We..."
https://kr.indeed.com/viewjob?jk=6f3222a775043285 ,Seeking Motivated Instructor for April D...,Chung Dahm Learning,부산광역시,winter... summer all contracts... minimum one year term E2 sponsorship Requirements... native English...
https://kr.indeed.com/viewjob?jk=03b58466d264a0b3 ,LE AE (차장급),Success Korea,서울 강남구,line knowledge. ? Ability to develop long- term strategic and executive level... develop long- term strategic and executive...
https://kr.indeed.com/viewjob?jk=eb36d335fefa479d ,"Engineering Strategic Account Manager, K...",Aveva,서울,Develop long term relationships... Thinks through and considers the long term cost/benefit implications of change...
https://kr.indeed.com/viewjob?jk=d2c184398f6f7c00 ,"Digital Sales & eCommerce Manager, Korea",Autodesk,서울,senior leadership and business partners to help create long term eCommerce & digital strategy... voice of Korea in all...
https://kr.indeed.com/viewjob?jk=54e3f6aba6e23df2 ,"Specialized Sales GTM Strategy Lead, AWS",Amazon Web Services Korea LLC,서울,Vertical Leads to build and drive the short and long- term GTM strategy. · Participate in Field and WWSO specialized sales...
https://kr.indeed.com/viewjob?jk=68e584fc44c1d706 ,"Sales Executive (차,부장급)",Success Korea,대한민국,presentation and negotiation skills. - Ability to develop long- term strategy with customer. [자격요건] - 관련분야 경력 10~15년 - 학사 이상...
https://kr.indeed.com/viewjob?jk=dcaca86393afc521 ,eCommerce Team Manager (+10 years),Success Korea,서울,eCommerce Sales Strategy Development Develop Short- term / Long- term eCom business plan and strategies Develop integrated...
https://kr.indeed.com/viewjob?jk=cbc38da7d3b7c9de ,외국계 의료기기 반도체 기업 Senior Application Engin...,Success Korea,서울 마포구,local customers... accounts for both short term and long term requirements and goals of customers. [자격요건] Fleunt English...
https://kr.indeed.com/viewjob?jk=e7cc75e364930f7a ,Operational Excellence Project Manager,Success Korea,서울 성동구,projects for achieving operation goals. Define and implement long term productivity roadmap through innovation and process...
https://kr.indeed.com/viewjob?jk=35557823eda0431d ,Inside Sales Account Mgmt II (대리급),Success Korea,서울,multiple stakeholders. - Effectively balances short term and long term priorities. - Develops and implements account plans...
https://kr.indeed.com/viewjob?jk=69dcef9880dd645d ,Key account manager,Success Korea,대한민국,"company guideline - Develop annual account plan and mid- term strategy - Planning account activity, promotion and budget(6..."
https://kr.indeed.com/viewjob?jk=f0eae014af34c7c4 ,Dell Technologies Select Enterprise Arch...,Dell Technologies,서울,"most well-known and complex enterprises while building long- term, trusted relationships with clients. DT Select accomplishes..."
https://kr.indeed.com/viewjob?jk=f122f176588b5334 ,Senior Solution Sales Executive-ARIBA,SAP,서울,"passionate about customer success, customer delight, and long- term customer relationships Outcome focused... role..."
https://kr.indeed.com/viewjob?jk=ec15636a0b3b8e0e ,Sales & Marketing Specialist,Success Korea,서울,Company is a newly created legal entity offering Long Term as well as Short Term Rental. The company will constantly innovate...
https://kr.indeed.com/viewjob?jk=090f53bc105c416d ,Strategy Manager Dell CSG-SnP Strategy,Dell Technologies,서울,global business to help achieve our long- term growth objectives... also keep us... address long- term business objectives...
https://kr.indeed.com/viewjob?jk=8dfd86d68fb9b1c3 ,외국계 IT 기업 - Account Executive (네트웍 영업),Success Korea,서울 강남구,skills. 8. Ability to develop long- term strategic and executive level relationships... develop long- term strategic and executive...
https://kr.indeed.com/viewjob?jk=7018842f381480e1 ,Pharmacy Sales Representative (4~7년차),Success Korea,서울,based on efficient paper work - Long- term career aspiration fits the organization... paper work - Long- term career aspiration...
https://kr.indeed.com/viewjob?jk=396ad32b5af8310f ,Hiring FT&PT Summer Program Instructors,One-Stop Prep,대한민국,provided after successful completion of contracted term. [Housing Support] Company will provide housing stipend...
https://kr.indeed.com/viewjob?jk=1771c663191a6554 ,Account Manager - MediaMonks Korea,MediaMonks,서울,"expectations. Help business accounts grow... long- term success for all parties, delivering against monthly and annual..."
https://kr.indeed.com/viewjob?jk=8b364abc6923453e ,Sales Director for EMI Shield,Success Korea,경기도 수원,"term relation at various levels and disciplines, in order to maximize the value (top- and bottom-line) of short & long term..."
https://kr.indeed.com/viewjob?jk=983e9f192d5d375e ,Assistant Sales Engineer,Molex,경기도 안산,drive value creation for profitable business growth upon long term base. The candidate must have the ability to work well...
https://kr.indeed.com/viewjob?jk=417123553fd8298a ,Sales Manager (APAC),Echobox,서울,your region. You... charge of building long- term partnerships with key decision makers at large publishing companies...
https://kr.indeed.com/viewjob?jk=a2283c35d995d125 ,Communication Assistant Manager,Success Korea,서울,corporate social responsibility activities and plans for long- term business support. 자격조건> -Hold track record of progressive...
https://kr.indeed.com/viewjob?jk=3de8c4eb618ba9f0 ,Digital Advertising Project Manager (Ons...,Hogarth Worldwide,서울,upcoming short- term projects... office. We're looking for long- term freelance partners so... end-date...
https://kr.indeed.com/viewjob?jk=28959b91f565de1e ,외국 상용차 재무기획(차장급),Success Korea,경기도 용인,have a responsibility of company strategy for both short- term and long- term... Directly report to controller for various...
https://kr.indeed.com/viewjob?jk=1bb07724594e878e ,Chemistry and/or Biology Teacher - A-Lev...,Kings Education - Seoul Centre,서울 강남구,"practical hours per term, 4 terms a year (Sept-early Dec, Jan-April, April-June, June-July). During non- term time, teacher..."
https://kr.indeed.com/viewjob?jk=b736d2fd4ccd3ba4 ,Human Resources Specialist,US Department of Defense Education Activity,대한민국,Land & base management Certain current or former term or temporary federal employees of a land or base management agency...
